{
  "schema": "r4b1t-source-catalog-v1",
  "catalog_id": "awesome-pentest-enaqx-v1",
  "corpus": "r4b1t-cybersecurity-v1",
  "source": {
    "url": "https://github.com/enaqx/awesome-pentest",
    "revision": "d70480bad2020b90299363ccb0ebf65fb75653d7",
    "path": "README.md",
    "sha256": "sha256:88b702aa33c9655a3ed9bab67ec62ea8a857d96f62f1b96132c6488aa94c2101"
  },
  "snapshot_path": "corpus/sources/awesome-pentest-enaqx-d70480b.md",
  "scope": "cybersecurity",
  "extractor": "markdown-links-v1",
  "type_assertions": [
    {
      "heading": "Android Utilities",
      "resource_type": "security_tool"
    },
    {
      "heading": "Anonymity Tools",
      "resource_type": "security_tool"
    },
    {
      "heading": "Anti-virus Evasion Tools",
      "resource_type": "security_tool"
    },
    {
      "heading": "Books",
      "resource_type": "reference"
    },
    {
      "heading": "CTF Tools",
      "resource_type": "security_tool"
    },
    {
      "heading": "Cloud Platform Attack Tools",
      "resource_type": "security_tool"
    },
    {
      "heading": "Collaboration Tools",
      "resource_type": "security_tool"
    },
    {
      "heading": "DDoS Tools",
      "resource_type": "security_tool"
    },
    {
      "heading": "Data Broker and Search Engine Services",
      "resource_type": "reference"
    },
    {
      "heading": "Dorking tools",
      "resource_type": "security_tool"
    },
    {
      "heading": "Exfiltration Tools",
      "resource_type": "security_tool"
    },
    {
      "heading": "File Format Analysis Tools",
      "resource_type": "security_tool"
    },
    {
      "heading": "GNU/Linux Utilities",
      "resource_type": "security_tool"
    },
    {
      "heading": "Hash Cracking Tools",
      "resource_type": "security_tool"
    },
    {
      "heading": "Hex Editors",
      "resource_type": "security_tool"
    },
    {
      "heading": "Industrial Control and SCADA Systems",
      "resource_type": "security_tool"
    },
    {
      "heading": "Intentionally Vulnerable Systems",
      "resource_type": "lab"
    },
    {
      "heading": "Intentionally Vulnerable Systems as Docker Containers",
      "resource_type": "lab"
    },
    {
      "heading": "Intercepting Web proxies",
      "resource_type": "security_tool"
    },
    {
      "heading": "Metadata harvesting and analysis",
      "resource_type": "security_tool"
    },
    {
      "heading": "Multi-paradigm Frameworks",
      "resource_type": "security_tool"
    },
    {
      "heading": "Network Reconnaissance Tools",
      "resource_type": "security_tool"
    },
    {
      "heading": "Network Tools",
      "resource_type": "security_tool"
    },
    {
      "heading": "Network Traffic Replay and Editing Tools",
      "resource_type": "security_tool"
    },
    {
      "heading": "Network Vulnerability Scanners",
      "resource_type": "security_tool"
    },
    {
      "heading": "Network device discovery tools",
      "resource_type": "security_tool"
    },
    {
      "heading": "OSINT Online Resources",
      "resource_type": "reference"
    },
    {
      "heading": "Online Operating Systems Resources",
      "resource_type": "reference"
    },
    {
      "heading": "Online Penetration Testing Resources",
      "resource_type": "reference"
    },
    {
      "heading": "Open Sources Intelligence (OSINT)",
      "resource_type": "security_tool"
    },
    {
      "heading": "Operating System Distributions",
      "resource_type": "security_tool"
    },
    {
      "heading": "Other Lists Online",
      "resource_type": "reference"
    },
    {
      "heading": "Penetration Testing Report Templates",
      "resource_type": "reference"
    },
    {
      "heading": "Periodicals",
      "resource_type": "reference"
    },
    {
      "heading": "Physical Access Tools",
      "resource_type": "security_tool"
    },
    {
      "heading": "Privilege Escalation Tools",
      "resource_type": "security_tool"
    },
    {
      "heading": "Protocol Analyzers and Sniffers",
      "resource_type": "security_tool"
    },
    {
      "heading": "Proxies and Machine-in-the-Middle (MITM) Tools",
      "resource_type": "security_tool"
    },
    {
      "heading": "Reverse Engineering Books",
      "resource_type": "reference"
    },
    {
      "heading": "Reverse Engineering Tools",
      "resource_type": "security_tool"
    },
    {
      "heading": "Security Education Courses",
      "resource_type": "training_resource"
    },
    {
      "heading": "Shellcoding Guides and Tutorials",
      "resource_type": "training_resource"
    },
    {
      "heading": "Side-channel Tools",
      "resource_type": "security_tool"
    },
    {
      "heading": "Social Engineering Books",
      "resource_type": "reference"
    },
    {
      "heading": "Social Engineering Online Resources",
      "resource_type": "reference"
    },
    {
      "heading": "Social Engineering Tools",
      "resource_type": "security_tool"
    },
    {
      "heading": "Static Analyzers",
      "resource_type": "security_tool"
    },
    {
      "heading": "Steganography Tools",
      "resource_type": "security_tool"
    },
    {
      "heading": "Tor Tools",
      "resource_type": "security_tool"
    },
    {
      "heading": "Transport Layer Security Tools",
      "resource_type": "security_tool"
    },
    {
      "heading": "Vulnerability Databases",
      "resource_type": "dataset"
    },
    {
      "heading": "Web Exploitation",
      "resource_type": "security_tool"
    },
    {
      "heading": "Web Exploitation Books",
      "resource_type": "reference"
    },
    {
      "heading": "Web Vulnerability Scanners",
      "resource_type": "security_tool"
    },
    {
      "heading": "Web application and resource analysis tools",
      "resource_type": "security_tool"
    },
    {
      "heading": "Web injection tools",
      "resource_type": "security_tool"
    },
    {
      "heading": "Web path discovery and bruteforcing tools",
      "resource_type": "security_tool"
    },
    {
      "heading": "Windows Utilities",
      "resource_type": "security_tool"
    },
    {
      "heading": "Wireless Network Tools",
      "resource_type": "security_tool"
    }
  ]
}
